{
  "schema": 2,
  "account": "111111#1",
  "character": "Mira",
  "realm": "Silvermoon",
  "savedAt": 1761830400,
  "sections": {
    "achievements": {
      "scope": "account",
      "v": 1,
      "at": 1761829100,
      "src": "daily",
      "hash": "1e75aa9e8d41861727bfff3222b55b32d1150b6f6e7c8c71b7c82d3bee70cf67",
      "body": {
        "count": 7,
        "points": 12450,
        "scannedAt": 1761829100,
        "ids": ["ids1", "6,1,1,1,1,32u,bww"]
      }
    },
    "bags": {
      "scope": "char",
      "v": 1,
      "at": 1761829500,
      "src": "event",
      "hash": "ee8d53853d0343d4c360e32f8f694a8cd1c228f31c021dbce886fed00d2f152e",
      "body": {
        "slots": 146,
        "count": 2,
        "items": ["idv1", "5d0:1,4dag:16"],
        "gear": ["item:219331::::::::80:63::13:3:10354:1540:6652"]
      }
    },
    "char": {
      "scope": "char",
      "v": 1,
      "at": 1761829000,
      "src": "login",
      "hash": "ce65b037ec709e6a1d76ecdfaac5896780e7c3b5323bac8794c6d2af998a4b84",
      "body": {
        "name": "Mira",
        "realm": "Silvermoon",
        "class": "Mage",
        "classFile": "MAGE",
        "classID": 8,
        "race": "Blood Elf",
        "raceFile": "BloodElf",
        "raceID": 10,
        "faction": "Horde",
        "level": 80,
        "xp": 0,
        "xpMax": 0,
        "specID": 63,
        "spec": "Fire",
        "heroSpecID": 39,
        "ilvl": 652.4,
        "money": 183420000,
        "hearth": "Dornogal",
        "inGuild": true
      }
    },
    "futureThing": {
      "scope": "account",
      "v": 3,
      "at": 1761829300,
      "src": "login",
      "hash": "285255b1b017841c18357ebee492048f790dfae0309fd0993124d5184e562fbb",
      "body": {
        "anything": "kept raw"
      }
    },
    "gear": {
      "scope": "char",
      "v": 1,
      "at": 1761829000,
      "src": "login",
      "hash": "e352a7ae1c79733dc42b18b0323af20b6a36c78b1f2177c22b169446aab2cf30",
      "body": {
        "ilvl": 652.4,
        "slots": [
          {
            "slot": 1,
            "itemID": 212065,
            "item": "item:212065::::::::80:63::3:5:10356:10372:1540:6652",
            "ilvl": 658
          }
        ]
      }
    },
    "mounts": {
      "scope": "account",
      "v": 1,
      "at": 1761829010,
      "src": "login",
      "hash": "c7358300449fb59df3870257ad35008ed119fad4ceec1489d394c36c915199b4",
      "body": {
        "count": 6,
        "total": 1400,
        "ids": ["ids1", "6,1,4,e,1d3,az"]
      }
    },
    "pets": {
      "scope": "account",
      "v": 1,
      "at": 1761829010,
      "src": "login",
      "hash": "9c531a643256002c883b1015955cd2b899fa99c5019d0bf22cae6c19e581ea40",
      "body": {
        "count": 3,
        "species": ["idv1", "13:2:p:4,1:1:1:3"]
      }
    },
    "questLog": {
      "scope": "char",
      "v": 1,
      "at": 1761829500,
      "src": "event",
      "hash": "67d9952188428bae5eb9c22b9816a496eb7e295d61aaf4e511a2e43da344af70",
      "body": {
        "quests": [
          {
            "questID": 78713,
            "title": "The Weight of Duty",
            "level": 80,
            "complete": false,
            "tracked": true,
            "objectives": [
              {
                "text": "Speak to Moira",
                "done": false,
                "have": 0,
                "need": 1
              }
            ]
          }
        ]
      }
    },
    "questsDone": {
      "scope": "char",
      "v": 1,
      "at": 1761829010,
      "src": "login",
      "hash": "a3f9d843031c24532a385b4961bc5497925ba439c0a3aa3ff3e6cced066d3151",
      "body": {
        "count": 387,
        "ids": [
          "ids1",
          "k28,2,1,2,1,2,1,2,1,2,1,2,1,2,1,2,1,2,1,2,1,2,1,2,1,2,1,2,1,2,1,2,1,2,1,2,1,2,1,2,1,2,1,2,1,2,1,2,1,2,1,2,1,2,1,2,1,2,1,2,1,2,1,2,1,2,1,2,1,2,1,2,1,2,1,2,1,2,1,2,1,2,1,2,1,2,1,2,1,2,1,2,1,2,1,2,1,2,1,2,1,2,1,2,1,2,1,2,1,2,1,2,1,2,1,2,1,2,1,2,1,2,1,2,1,2,1,2,1,2,1,2,1,2,1,2,1,2,1,2,1,2,1,2,1,2,1,2,1,2,1,2,1,2,1,2,1,2,1,2,1,2,1,2,1,2,1,2,1,2,1,2,1,2,1,2,1,2,1,2,1,2,1,2,1,2,1,2,1,2,1,2,1,2,1,2,1,2,1,2,1,2,1,2,1,2,1,2,1,2,1,2,1,2,1,2,1,2,1,2,1,2,1,2,1,2,1,2,1,2,1,2,1,2,1,2,1,2,1,2,1,2,1,2,1,2,1,2,1,2,1,2,1,2,1,2,1,2,1,2,1,2,1,2,1,2,1,13td,5,5,5,5,5,5,5,5,5,5,5,5,5,5,5,5,5,5,5,5,5,5,5,5,5,5,5,5,5,5,5,5,5,5,5,5,5,5,5,5,5,5,5,5,5,5,5,5,5,5,5,5,5,5,5,5,5,5,5,5,5,5,5,5,5,5,5,5,5,5,5,5,5,5,5,5,5,5,5,5,5,5,5,5,5,5,5,5,5,5,5,5,5,5,5,5,5,5,5,5,5,5,5,5,5,5,5,5,5,5,5,5,5,5,5,5,5,5,5"
        ]
      }
    },
    "sessions": {
      "scope": "char",
      "v": 1,
      "at": 1761830400,
      "src": "event",
      "hash": "a15f51c943b21478650418651c536d60561557ced373518d0e98bd0286458c2a",
      "body": {
        "list": [
          {
            "start": 1761828000,
            "stop": 1761830400,
            "zones": ["Dornogal"],
            "maps": [
              {
                "mapID": 2339,
                "minutes": 40
              }
            ],
            "deaths": 1
          }
        ]
      }
    },
    "warband": {
      "scope": "account",
      "v": 1,
      "at": 1761829300,
      "src": "window",
      "hash": "d46a05e640ad29407bcb36fbd39d422e9fae8d4ec64e58e86a2c8bd59e6efaf5",
      "body": {
        "slots": 98,
        "count": 1,
        "items": ["idv1", "4sux:3"]
      }
    }
  },
  "dropped": {
    "account": {
      "calendar": {
        "at": 1761829400,
        "bytes": 2048
      }
    }
  }
}
